{
  "clientId": "tmk-it-solutions",
  "version": "1.0.0",
  "lastUpdated": "2026-10-26",
  "workstreams": [
    "Business Model & Commercial Strategy",
    "Legal, Regulatory & Intellectual Property",
    "Six-Product Sales Readiness",
    "Finance, Banking & Accounting",
    "Franchise Operations & SOPs",
    "Franchise Management Technology",
    "Franchise Recruitment & Marketing",
    "Training & Certification",
    "Central Delivery & Customer Support",
    "Partner Onboarding Documents",
    "Governance & Performance Monitoring",
    "Pilot Launch & Final Approval"
  ],
  "launchGates": [
    {
      "gateId": "GATE-1",
      "name": "Gate 1: Business Model Approved",
      "targetDate": "2026-11-15",
      "status": "Gate Cleared",
      "workstreamsCovered": ["Business Model & Commercial Strategy", "Finance, Banking & Accounting"]
    },
    {
      "gateId": "GATE-2",
      "name": "Gate 2: Legal & Financial Readiness",
      "targetDate": "2026-12-01",
      "status": "In Progress",
      "workstreamsCovered": ["Legal, Regulatory & Intellectual Property", "Finance, Banking & Accounting"]
    },
    {
      "gateId": "GATE-3",
      "name": "Gate 3: Product & Delivery Readiness",
      "targetDate": "2026-12-15",
      "status": "In Progress",
      "workstreamsCovered": ["Six-Product Sales Readiness", "Central Delivery & Customer Support"]
    },
    {
      "gateId": "GATE-4",
      "name": "Gate 4: Franchise Recruitment Readiness",
      "targetDate": "2027-01-05",
      "status": "In Progress",
      "workstreamsCovered": ["Franchise Recruitment & Marketing", "Partner Onboarding Documents"]
    },
    {
      "gateId": "GATE-5",
      "name": "Gate 5: Pilot Launch Readiness",
      "targetDate": "2027-01-20",
      "status": "Pending",
      "workstreamsCovered": ["Franchise Operations & SOPs", "Franchise Management Technology", "Training & Certification", "Pilot Launch & Final Approval"]
    },
    {
      "gateId": "GATE-6",
      "name": "Gate 6: National Expansion Approval",
      "targetDate": "2027-04-30",
      "status": "Pending",
      "workstreamsCovered": ["Governance & Performance Monitoring", "Pilot Launch & Final Approval"]
    }
  ],
  "items": [
    {
      "taskId": "FLR-BMS-001",
      "workstream": "Business Model & Commercial Strategy",
      "title": "FOFO Business Model Specification & RACI Architecture",
      "description": "Formulate comprehensive specification of Franchise Owned, Franchise Operated (FOFO) commercial structure, capital division, and operational RACI matrix.",
      "priority": "Critical",
      "ownerRole": "Analyst 1",
      "assignedPerson": "Senior Business Analyst",
      "reviewerRole": "Analyst 2",
      "classification": "Business research and modeling",
      "status": "Document Approved",
      "dependencies": [],
      "requiredEvidence": "Approved fofo-operating-model.md ratified in approval matrix",
      "relatedDocuments": ["clients/tmk-it-solutions/franchise-model/fofo-operating-model.md"],
      "acceptanceCriteria": "Exhaustive RACI matrix covering 25+ activities with unambiguous franchisor vs franchisee demarcations.",
      "targetDate": "2026-10-26",
      "completionDate": "2026-10-26",
      "approvalAuthority": "Managing Partner",
      "launchGate": "Gate 1: Business Model Approved",
      "isBlocker": true
    },
    {
      "taskId": "FLR-BMS-002",
      "workstream": "Business Model & Commercial Strategy",
      "title": "Franchise Fee Structure & Promotional Tier Policy",
      "description": "Establish policy for promotional ₹25,000 joining fee (first 10 units) and standard ₹50,000 fee with documented renewal terms.",
      "priority": "High",
      "ownerRole": "Analyst 1",
      "assignedPerson": "Senior Business Analyst",
      "reviewerRole": "Analyst 2",
      "classification": "Business research and modeling",
      "status": "Document Approved",
      "dependencies": ["FLR-BMS-001"],
      "requiredEvidence": "Approved fee-structure.md and commercial assumptions",
      "relatedDocuments": ["clients/tmk-it-solutions/franchise-model/fee-structure.md"],
      "acceptanceCriteria": "Clear joining fee terms, renewal fee rates, and waiver boundaries documented without ambiguity.",
      "targetDate": "2026-10-26",
      "completionDate": "2026-10-26",
      "approvalAuthority": "Managing Partner",
      "launchGate": "Gate 1: Business Model Approved",
      "isBlocker": false
    },
    {
      "taskId": "FLR-BMS-003",
      "workstream": "Business Model & Commercial Strategy",
      "title": "40:60 Net Revenue Sharing Rules & Machine Config",
      "description": "Define contractual revenue-sharing percentages (40% Franchisee : 60% TMK) and machine-readable JSON configuration.",
      "priority": "Critical",
      "ownerRole": "Analyst 2",
      "assignedPerson": "Financial Analyst",
      "reviewerRole": "Analyst 1",
      "classification": "Finance and accounting",
      "status": "Document Approved",
      "dependencies": ["FLR-BMS-001"],
      "requiredEvidence": "Valid revenue-sharing-config.json and verified 100% split tests",
      "relatedDocuments": [
        "clients/tmk-it-solutions/franchise-model/revenue-sharing-rules.md",
        "clients/tmk-it-solutions/franchise-model/revenue-sharing-config.json"
      ],
      "acceptanceCriteria": "Split rule percentages sum to exactly 100% and segregate statutory taxes.",
      "targetDate": "2026-10-26",
      "completionDate": "2026-10-26",
      "approvalAuthority": "Finance Director / CA",
      "launchGate": "Gate 1: Business Model Approved",
      "isBlocker": true
    },
    {
      "taskId": "FLR-BMS-004",
      "workstream": "Business Model & Commercial Strategy",
      "title": "Six-Product Market Demand Brief & TAM/SAM/SOM Sizing",
      "description": "Quantify total addressable market and serviceable opportunity for TMK software portfolio across Tier-2/3 Indian markets.",
      "priority": "High",
      "ownerRole": "Analyst 1",
      "assignedPerson": "Senior Business Analyst",
      "reviewerRole": "Analyst 2",
      "classification": "Business research and modeling",
      "status": "Document Approved",
      "dependencies": [],
      "requiredEvidence": "Empirically referenced demand analysis brief",
      "relatedDocuments": ["clients/tmk-it-solutions/research/six-product-demand-analysis.md"],
      "acceptanceCriteria": "Market sizing grounded in verified research evidence IDs from Nasscom and industry filings.",
      "targetDate": "2026-10-26",
      "completionDate": "2026-10-26",
      "approvalAuthority": "Practice Lead",
      "launchGate": "Gate 1: Business Model Approved",
      "isBlocker": false
    },
    {
      "taskId": "FLR-BMS-005",
      "workstream": "Business Model & Commercial Strategy",
      "title": "Taluka-Based Territory Segmentation Strategy",
      "description": "Define territorial boundaries utilizing sub-district (Taluka / Tehsil) administrative divisions with TOS scoring.",
      "priority": "High",
      "ownerRole": "Analyst 1",
      "assignedPerson": "Senior Business Analyst",
      "reviewerRole": "Analyst 2",
      "classification": "Business research and modeling",
      "status": "Document Approved",
      "dependencies": ["FLR-BMS-004"],
      "requiredEvidence": "Documented taluka territory brief and demographic criteria",
      "relatedDocuments": ["clients/tmk-it-solutions/research/taluka-based-territory-strategy.md"],
      "acceptanceCriteria": "Clear taluka allocation criteria preventing regional density conflicts.",
      "targetDate": "2026-10-26",
      "completionDate": "2026-10-26",
      "approvalAuthority": "Practice Lead",
      "launchGate": "Gate 1: Business Model Approved",
      "isBlocker": false
    },
    {
      "taskId": "FLR-BMS-006",
      "workstream": "Business Model & Commercial Strategy",
      "title": "Three-Year Expansion Growth Vision & Wave Rollout Plan",
      "description": "Establish 36-month expansion trajectory: Wave 1 Pilot (3 units), Wave 2 Western Maharashtra (15 units), Wave 3 Statewide (50 units).",
      "priority": "Medium",
      "ownerRole": "Analyst 1",
      "assignedPerson": "Senior Business Analyst",
      "reviewerRole": "Managing Partner",
      "classification": "Documentation and presentation",
      "status": "Document Approved",
      "dependencies": ["FLR-BMS-005"],
      "requiredEvidence": "Approved three-year-growth-vision.md",
      "relatedDocuments": ["clients/tmk-it-solutions/sales-marketing/three-year-growth-vision.md"],
      "acceptanceCriteria": "Sequenced wave schedules aligning partner recruitment targets with central deployment capacity.",
      "targetDate": "2026-10-26",
      "completionDate": "2026-10-26",
      "approvalAuthority": "Managing Partner",
      "launchGate": "Gate 1: Business Model Approved",
      "isBlocker": false
    },
    {
      "taskId": "FLR-LGL-001",
      "workstream": "Legal, Regulatory & Intellectual Property",
      "title": "Master Franchise Agreement Drafting",
      "description": "Author complete legal agreement draft specifying license grant, payment terms, territory rules, audit rights, and termination.",
      "priority": "Critical",
      "ownerRole": "Analyst 1",
      "assignedPerson": "Senior Business Analyst",
      "reviewerRole": "Legal Counsel",
      "classification": "Documentation and presentation",
      "status": "Document Created",
      "dependencies": ["FLR-BMS-001", "FLR-BMS-003"],
      "requiredEvidence": "Draft agreement bearing non-binding legal disclaimer header",
      "relatedDocuments": ["clients/tmk-it-solutions/legal-drafts/franchise-agreement-draft.md"],
      "acceptanceCriteria": "Comprehensive 15-clause agreement draft covering all standard commercial franchising terms.",
      "targetDate": "2026-10-26",
      "completionDate": "2026-10-26",
      "approvalAuthority": "Legal Counsel",
      "launchGate": "Gate 2: Legal & Financial Readiness",
      "isBlocker": true